{"claims":{"active_commitments":{"c1":"Add no infrastructure or dependency.","c2":"Migrate and recover tenants independently."},"hard_constraints":{"x1":"Global traffic stays live and each tenant write pause is at most 30 seconds.","x2":"Exactly one store is authoritative before and after the atomic route change.","x3":"Copying is resumable and idempotent from a durable tenant checkpoint.","x4":"Cutover is a compare-and-swap guarded by high-watermark and verification evidence."},"unresolved_work":{"w1":"Determine whether the decision and dependency plan preserve authority through cutover and recovery."}},"current_responsibility":"Independently review the candidate tenant-store migration decision and cutover plan.","format":"torc-claim-capsule-v1","handoff_reason":"independent_challenge","lineage_identity":"cross-agent-smoke/design-cutover-plan","schema_version":1,"source_revision_id":"candidate-a91174d8bf1299ea"}
