{"claims":{"active_commitments":{"c1":"dispatch and dispatch_batch must call route_request directly."},"hard_constraints":{"x1":"legacy_route must remain importable and directly delegate to route_request.","x2":"Unknown kinds must retain the exact ValueError behavior.","x3":"Public signatures and dependencies must not change."},"settled_decisions":{"d1":"route_request is the sole current routing implementation."},"superseded_directions":{"s1":"legacy_route is superseded and production callers must not route through it."}},"current_responsibility":"Independently review the candidate routing refactor against the authoritative architecture decision.","format":"torc-claim-capsule-v1","handoff_reason":"independent_challenge","lineage_identity":"cross-agent-smoke/refactor-superseded-path","schema_version":1,"source_revision_id":"candidate-8adde67f95bbeec5"}
