{"claims":{"active_commitments":{"c1":"Return a normal insertion-ordered dict.","c2":"Do not add dependencies or change the public signature."},"hard_constraints":{"x1":"Header names have case-insensitive logical identity.","x2":"Replacing a logical header must not move its first position.","x3":"The last occurrence supplies the emitted spelling and value.","x4":"Neither input mapping may be mutated."},"unresolved_work":{"w1":"Determine whether the candidate satisfies every required behavior and identify concrete defects."}},"current_responsibility":"Independently review the candidate header-merging repair against the frozen requirements.","format":"torc-claim-capsule-v1","handoff_reason":"independent_challenge","lineage_identity":"cross-agent-smoke/bug-hidden-regression","schema_version":1,"source_revision_id":"candidate-fcd30fc16e7a3792"}
